review_date,marketplace,customer_id,review_id,product_id,product_parent,product_title,product_category,star_rating,helpful_votes,total_votes,vine,verified_purchase,review_headline,review_body
1995-10-16,US,53096091,R3IBCEE3REG4PZ,827349912,623851419,"Telephone Triage: Theory, Practice, and Protocol Development",Books,5,10,10,FALSE,FALSE,Excellent book on telephone triage. Highly recommended.,This textbook has become a standard reference at triage call centers across the U.S. A *must* read for either the new triage nurse or an experienced one.
1995-10-17,US,51747709,R1P5J3FNBWTFXY,517122707,161411385,A Confederacy of Dunces,Books,5,0,0,FALSE,FALSE,A winner that didn't last. Only a mothers love remained,"The story behind the book is almost better than the work. But make no mistake, the work will endure."
1995-10-17,US,51747709,R3LS9CLPP1KRHX,553272934,454149734,Hunger of Memory : The Education of Richard Rodriguez,Books,5,0,4,FALSE,FALSE,"Everyone with the surname Rodriguez, should read this book.","I read this book and it changed my life. I meet the author at a party and did not like him. But, I still loved his writing and how his work spoke to me."
1995-10-18,US,53087960,R14PFL0QEHSP3O,393309398,2286760,Out of Canaan: Poems,Books,5,1,2,FALSE,FALSE,"Honest, well-written modern poetry.","This is the first book of poetry by Mary Stewart who also teaches a Poetry Workshop in NYC that is attracting the best writers of contemporary poetry in the East. This collection is well-written, structurally clean, cogent, and, perhaps most of all, from the heart. It makes the reader wonder how one diminishes one life by not confronting one's pains and sorrows."
1995-10-18,US,53096063,R869EPLN1934S,679419462,861735579,The Lost World,Books,1,0,2,FALSE,FALSE,A sickeningly pathetic rehash of Jurassic Park!,"It had some pretty good parts but for the most part if you read Jurassic Park you have read this. They have two young children (a girl and a boy), a rugged female scientist who won't be stereotyped, a greedy old man who meets up with compys. Then of course there is Malcolm, who DIED in the first book in case anyone forgot. He also ends up exactly as he did in the first book (albeit not DEAD!), a hole in his leg and babbling incoherently on morphine. Now I know why Crichton doesn't do sequels"
1995-10-18,US,53096393,R32B90DLSYAJ37,1568842406,512561751,Windows 95 for Dummies,Books,2,2,2,FALSE,FALSE,only the terminally computer illiterate should get this,"The VAST majority of information found in this book is stuff that the semi-knowledgable Win3.1 user will be able to figure out on his/her own in just a few hours. Good for folks who just bought a computer, pre-loaded with Win95; but for anyone else, don't waste your money."
1995-10-19,US,53068470,R3T9SE8I5E95SV,091488185X,396871483,Elegant Stitches: An Illustrated Stitch Guide & Source Book of Inspiration,Books,5,33,33,FALSE,FALSE,Best-selling silk ribbon embroidery book available.,"The most complete how to book on using silk ribbon for embroidery. Written by world reknown author, teacher and lecturer Judith Baker Montano. Read it in French Japanese or English. This book shows each stitch with a how to line drawing as well as a blow up of it within a piece of finished art work. Judith's palette is one of a kind, her jewel toned floral designs are easy to duplicate with this timeless referance book. Everything you need to get started working with wonderful silk ribbons that are now available at most sewing and craft stores. Embellish a tuxedo jacket lapel, a pair of velvet flats, a matching pendent and more when you learn the how easy it is to do this wonderful handwork that began in the 1700's. Full color photos. Even a section for left handers. Judith even shows how to create your own unique designs in a wonderful chapter at the end. What a find"
1995-10-20,US,51872866,R158EHHL2USQOS,844665290,358452686,The Man Who Mistook His Wife For A Hat,Books,5,1,2,FALSE,FALSE,EVERYTHING by Oliver Sacks is worth reading!,"Fascinating inquiry into the workings of the brain and mind. Well written, easy for the layman to understand."
1995-10-21,US,53095950,R36MVEDC7S4CEO,811208478,148567452,Journey to the End of the Night (English and French Edition),Books,5,1,2,FALSE,FALSE,Lightnings of style in the night of experience,"Celine once said he wrote to make other writers unreadable. While this may strikes as a strange project, I would agree, with many others, that it was largely fulfilled. Throughout his life, Celine evolved a very personal, &quot;jubilatoire&quot; (sorry, my first language is French) style that does make most of modern French authors look like zombies. &quot;Journey&quot;, Celine's first book, includes unexpected borrowings form colloquial, spoken French. A look to further works, however, shows that these borrowings were only a starting point for a unique work on the French language. From the night of his personal experience, Celine reaches through language to ultimate elegance, light and lightness - a transfiguration arguably difficult to translate into English. Jacques P. Du Pasquier Geneva, Switzerland Editor of Hache, [...]"
1995-10-22,US,53096008,R351SC94GU71FE,393307069,659543252,Post Captain (Aubrey/Maturin),Books,5,0,1,FALSE,FALSE,Second in the Aubrey-Maturin series of Napoleonic War tales,"If you want to get the flavor of O'Brian's tales of the sea adventures of England's Capt. Aubrey and his close friend Dr, Steven Maturin this is the best book in the series to stsrt from. Returning from a long campaign as a Commander Jack &amp; Steven spend a long spell in England. O'Brian introduces us to their future wives and his sights and sounds of English country life will transport you back to early 19th century England. A rousing tale that ends with Jack becoming a Post Captain. No one captures the language of the times like O'Brian and you will want to read all of the 16 volumes that make up this series. The Aubrey-Maturin stories are the best in this genre."
1995-10-22,US,53096008,R2V0V2U292068L,523423012,932328326,To Live and Die in L.A.,Books,5,2,3,FALSE,FALSE,Excellent L.A. cops story of drug enforcement,Better than the Movie an action filled story of LA undercover cops running a drug bust. Proably the best of Petievich's books. His knowledge of law enforcement makes this a real page turner.
1995-10-22,US,53096008,R1XSBANXHY2LOB,1556113560,938603406,The Gun Ketch,Books,5,0,0,FALSE,FALSE,The adventures of Lt.Lewrie RN in early 19th Century Navy,"This is Dewey Lambdin's 5th book in the Lewrie series. A far more down to earth character of the Napoleonic War British Navy heros Alan Lewrie likes his women and is first a lady's man and a seaman second. Still wondering how he ever became a British oficer, his marriage to Caroline and transfer to Captain the Bomb Ketch ALACRITY for duty in the Bahamas starts a new adventure for this lusty and unlikely hero. If you enjoy the Aubrey and Hornblower series these stories are more fun to read but will keep you turning the pages to find out how Alan escapes from one problem to another."
1995-10-22,US,53096008,R2WVO8MZVW9RWP,044651862X,58848637,The Celestine Prophecy: An Adventure,Books,2,0,0,FALSE,FALSE,An overhyped book and one of the worst written,"Having been given this book as a present by my son who claims he was inspired by the narative, I was very let down. For a book that is basically suppose to be for self enlightenment why did the author go to this hokey story line. He would have been better off writing it as a straight book for enlightenment... That is if he could write!!!! If you want to see what writing is all about read Umberto Eco's new magnificent novel &quot;The Island Of The Day Before&quot;. A guess to sell a best seller today you need to write to the level of the masses.. A sad commentary on our times."
1995-10-23,US,53096008,RR7Z2U9R6RHY6,316353957,53525621,Blue Highways: A Journey into America,Books,5,2,2,FALSE,FALSE,Journey across the lesser known byways of America,Mr. Moon's unforgetable journey to the off the beaten paths of America. He captures the soul of our nation as it use to be. Here are desciptions of the people that one rarely hears or reads about. If you want to learn about what makes this country great...read Blue Highways. It will give you inspiration to journey to the off-beat roads of America.
1995-10-23,US,53096228,R39JMI1B1W7ZW5,679440380,630529008,Palimpsest: A Memoir,Books,4,3,3,FALSE,FALSE,"enjoyable, erratic, gossipy","A must-read for Gore's fans. He knew many of the important figures of the 20th century personally, and has a more brilliant and insightful mind than most of them. This book, written from the point of old age, is a hodge-podge of reflections, and frank reminiscences. Includes many gossipy tales; his account of verbal battles with Truman Capote in front of an alarmed Tennessee Williams are priceless."
1995-10-23,US,52194881,R3H4NOKDONXLDS,824815130,174665453,The Hikers Guide to O'Ahu (A Kolowalu Book),Books,5,7,7,FALSE,FALSE,A must-have if you plan to hike on the island of Oahu.,"Stuart Ball's book is an excellent resource for anyoneplanning to hike on Oahu. In fact, it has been in mybackpack on most hikes I've been on. Great info on how to get to the trailhead, the length and level of difficulty of the hike, and insights about what to see and expect when you're on a particular trail. The best Hawaii-based book I've read."
1995-10-24,US,53096131,R1REVOWTFNNBDL,442019416,608525973,Essential Client Server Survival Guide,Books,4,0,0,FALSE,FALSE,Excellent summary of the state of the client/server industry,This is an excellent &quot;Get me caught up quick&quot; book on client server technology and I would recommend it for anyone who has been in mainframeland and wants to get a perspective on the C/S paradigm. I enjoyed the easy fluid style of presentation. This book is an investment.
1995-10-24,US,53096021,RSD9IZ6E4G65J,679406395,13081295,"Monsters Of The Sea: The History, Natural History, and Mythology of the Oceans' Most Fantastic Creatures",Books,5,1,7,FALSE,FALSE,Best book on the subject ever written!,"I always believed that the authors were the best qualified people to review their own books. I wrote this book, and I truly believe that it is the best book on the subject ever written. I loved the research, and the picture research as well (It has 150 spectacular illustrations). But most of all, I liked the great reviews I got from -- among other publications -- The New York Times, Nature, and Scientific American"
1995-10-24,US,53004137,R1EWQX83PW1I4B,1563891662,332327217,The Big Book of Death,Books,5,8,8,FALSE,FALSE,"Sick, morbid and lots of fun!","&quot;The Big Book of Death,&quot; the second in Paradox Press's &quot;Big Book of&quot; series, is a fascinating, disturbing treatment of the subject we simultaneously fear and can't get enough of: death. With sections on pointless deaths, capital punishment, famous cemeteries, and lots of other aspects of the big D, it's an interesting and informative book. The artwork, by a multitude of comic artists, is also excellent. It may be a comic, but this book is definitely not for kids. If you're a grownup with a fascination for death and a slightly morbid sense of humor, though, check it out!"
1995-10-24,US,53004137,R2SDITORS21ZYV,425121046,533918267,Demon Night,Books,4,6,6,FALSE,FALSE,An interesting variant on Stephen King's &quot;'Salem's Lot.&quot;,"&quot;Demon Night&quot; is an interesting read, definitely recommended for fans of Straczynski, author of &quot;Othersyde&quot; and creator of the hit syndicated sci-fi TV series &quot;Babylon 5.&quot; Although it is strongly reminiscent of Stephen King's &quot;'Salem's Lot,&quot; it is worth reading on its own merits too. The storyline is compelling, a fascinating variant on the &quot;vampires overtake a small town&quot; plot. I prefer Straczynski's scriptwriting and short stories to his novels. But the novels are also worthwhile, especially for diehard fans."
1995-10-24,US,53096033,R1DM07XAJLEI5M,078686043X,238795097,The Beardstown Ladies' Common-Sense Investment Guide: How We Beat the Stock Market - And How You Can Too,Books,5,2,9,FALSE,FALSE,Excellent book for anyone new to the stock market.,I just started an investment club with a group of friends and this book has become our bible. It is a must for anyone new to investment clubs or individual investing
1995-10-24,US,53004137,RWKK7AZ9DTIW4,1563891654,17181867,"The Big Book of Urban Legends: 200 True Stories, Too Good to be True!",Books,5,18,20,FALSE,FALSE,A fantastic book on a fascinating subject!,"Did I ever tell you about what happened to my cousin's college roommate's best friend? No? Well ... Who out there can honestly say he's never fallen for an urban legend, told as true by some acquaintance? The maniac in the back seat? The Mexican pet? The doped-up babysitter who microwaved the baby? The spider in the hairdo? We've all been the victims of these stories at some point in our lives. People pass them around at cocktail parties and office water coolers, always claiming that they really happened to a friend of a friend (but never able to offer a name of the unfortunate victim). And Jan Harold Brunvand is the master collector and debunker of the stories. Paradox Press wisely got Brunvand to write its mega-comic, &quot;The Big Book of Urban Legends.&quot; Even for UL aficionadoes, there are a few new ones here. And the irreverent comic format is perfect for these just-plausible-enough modern tall tales. It's also a great way to introduce friends to ULs (or to disprove the stories your friends try to pass off as true)."
1995-10-24,US,53095936,R46RVPXPTEUVM,517702258,944860236,Tom: The Unknown Tennessee Williams,Books,5,3,3,FALSE,FALSE,An outstanding biography - a sure prize contender,"&quot;Tom&quot; by Lyle Leverich is a truly outstanding work. Tennessee Williams himself picked Leverich to be his &quot;official&quot; biographer before he died. Indeed, Leverich was quite friendly with Williams the last few years of his life, and came to know him quite well. Ordinarily friendship can cause the biographer to lose his objectivity. That's not the case here. But the book isn't simply a collection of dates and events - it reads like a good novel, and is extremely well-written and well-researched. I'll be very surprised if &quot;Tom&quot; isn't nominated for a major literary award this year."
1995-10-24,US,53096008,RUZZCQY0HXME1,807118737,796615899,"The Battle of the Wilderness, May 5--6, 1864",Books,5,3,3,FALSE,FALSE,A Civil War battle book of the highest caliber.,"If you are a Civil War buff as I am you will find Battle of The Wilderness one of the best researched and written books of the gendre. Rhea's descriptions are vivid and even though you know the outcome of this battle you relive every hour through his step by step recounting of the action. For those who have never read Civil War history this is a moving tale of two of the greatest Generals locked in mortal combat, as well as how the common soldier fared in one of the most bloody battles of the Civil War."
1995-10-25,US,53060455,R4SZYHQ0XE1Q,385313837,326245620,Hula,Books,5,3,4,FALSE,FALSE,"wonderful,amazingly accurate acount of girlhood,textural","I read this book in one sitting. She captures the smells, feeling, fears of young girls in the hot summer. Read it"
1995-10-26,US,53096541,R2DQ2J4R88MOAG,446602450,454060985,Spencerville,Books,5,1,2,FALSE,FALSE,Fantastic and Captivating,"This book really held my attention. I could not put it down and when I absolutely had to, I couldn't wait to get back to it"
1995-10-27,US,53074911,R2T6PO9QCW7NFY,912180129,949612214,Petroglyphs of Hawaii,Books,1,4,5,FALSE,FALSE,"Poor, promotes destruction of rock art","Very simple intro to Hawaiian rock art. Perhaps best suited for grade school level. Inadvertently promotes destruction of rock art by &quot;rubbings&quot;. A better book would be Cox &amp; Stasack's &quot;Petroglyphs of Hawaii&quot;, available from the Bishop Museum Press."
1995-10-28,US,53095983,R320GVTM5RXZNU,786881046,505457356,Pulp Fiction: A Quentin Tarantino Screenplay,Books,5,3,4,FALSE,FALSE,A treat for any Pulp Fiction fan.,Shows how much the stars ab-libbed and also shows's QT's gift for dialog. An excellent companion to the film. (**** out of 4)
1995-10-29,US,51864151,R1FMZOKK30ZVXW,231082363,856884446,The Little Dinosaurs of Ghost Ranch,Books,5,4,4,FALSE,FALSE,A good book about one small dinosaur.,"This is a well-written book that covers the discovery, excavation, and reconstruction of a dinosaur (coelophysis). Discussion centered on this small therapod incorporates broader material, so that the reader gets an understanding of the life and times of other prehistoric creatures in addition to a detailed account of coelophysis"
1995-10-30,US,53095502,R2GOYBPBINGI6,61009059,830758196,"One for the Money (Stephanie Plum, No. 1) (Stephanie Plum Novels)",Books,5,1,1,FALSE,FALSE,"Watch out Grafton,Paretsky,Gores...Evanovich is coming!!",Janet Evanovich has created a character that will instantly make you laugh. It is a wonderful mystery story and is sure to help her build a following in the mystery genre
1995-10-31,US,53095057,R33YNIWSOM4FXT,688043941,533308544,Authentic Mexican: Regional Cooking from the Heart of Mexico,Books,5,22,22,FALSE,FALSE,Excellent in every way!,"Excellent cookbook. The recipes are the best I've ever found on true Mexican cooking. There is a restaurant in Chicago owed and operated by the authors of this book. You must check it out if you're ever in Chicago. The cookbook itself is extremely easy to follow. It provides very useful sidebar comments on practical tips and regional variations. This helps make this cookbook a dream! If you're looking for a Mexican cookbook, there's no better one to be found"
1995-10-31,US,53096399,R29FM9JVXBEPEC,446391581,156881633,A Whack on the Side of the Head: How You can be More Creative,Books,4,2,2,FALSE,FALSE,"fast read, useful ideas","structured in an easy to remember fashion good ideas, practical ideas"
1995-11-02,US,53095914,R2ZNGRPS98S7N5,821746324,355069804,A Midsummer's Magic (A Zebra Holiday Regency Romance),Books,5,2,6,FALSE,FALSE,Funny and magical!,"When magical spells and love collide, everything goes wrong! This is a light, comical romance, full of fun."
1995-11-02,US,53095959,R3JY8I4S01ZR9J,919359078,707095326,"High Society (Cerebus, Volume 2)",Books,4,1,1,FALSE,FALSE,Most mature comic book series I ever read.,"If you've never read comics because you think they are too childish, contain too much violence or too much cheap sex, start with this Cerebus phonebook.<BR> The book tells of Cerebus, an aardvark in a human world, who slowly rises to great power in the city-state of Iest. It describes (in great detail, I might add) the political manipulations, religious dogmas and problems in his relationships with the human population that Cerebus has to deal with as he campaigns to become prime-minister of Iest.<BR> This is the second volume in the Cerebus-series, but my opinion is that it is the best place to start with the series and get hooked forever."
1995-11-02,US,53092930,R2XN974V4OQCZA,345397363,380646713,"Complete Directory to Prime Time Network and Cable TV Shows, Sixth Edition (6th ed, Revised)",Books,5,1,1,FALSE,FALSE,The authority on television.,"This is perhaps the most useful reference book ever, giving complete information on everything that's ever been on prime-time or late-night television in the United States. Plus a complete index of all the actors, and a bunch of useful appendices. Good for looking up specific information, and also fun to read cover-to-cover, if you can find the time."
1995-11-02,US,53095881,R2XQTCOBWNCEAC,345350499,627223385,The Mists of Avalon,Books,5,0,0,FALSE,FALSE,One of the best books I've ever read!,"Marion Zimmer Bradley brings King Arthur's court to life through the eyes of a woman in The Mists of Avalon. It is by far one of the best novels I've ever read, and I recommend it to anyone who is interested in seeing a legend from a different point of view"
1995-11-03,US,53095862,R14ROWVBQ7XEJD,670858692,40528119,Rose Madder,Books,4,0,0,FALSE,FALSE,"real, yet not. King's a great storyteller, as usual","I was surprised by how natural, as opposed to supernatural, the book started out. But both the natural and supernatural elements were spell-binding. Very different subject matter for King"
1995-11-03,US,52815693,R2WQA2A4U75121,932716164,996304390,Grammars for Jess & Twenty Two Cropped Sets,Books,5,0,0,FALSE,FALSE,Great modern text/poetry - truly cool,Good poetry read for those into one of the best poets in America. Lots of personal stuff but not sappy. Neat and sharp.
1995-11-03,US,53095862,R2P3PS223QK7EB,449902242,270954632,"Healthy Sleep Habits, Happy Child",Books,5,1,1,FALSE,FALSE,Changed my life,"My 8 month old son suddenly wasn't sleeping. He'd wake up 5 and 6 times in the night (when he'd been sleeping through) and we'd go to him and hold him, as always. He wasn't napping at day care. Little did we know--we should have been letting him cry it out! I read this book one week ago, and my son has completely turned around. He's sleeping through the night and at day care. What I didn't realize was that we were harming him by not letting him develop self-soothing skills (like sucking on his fingers, rocking, cooing, even crying) which he needed to put himself to sleep when we're not around. I had thought &quot;Cry it out. That's not natural. He'll think he's abandoned. He'll cry for hours.&quot; But he never cried for more than 10 minutes. Now he's a happy baby again"
1995-11-03,US,52176002,R1M97P3WEMGYIG,688124089,595253424,Shadow of a Dark Queen (The Serpentwar Saga),Books,4,0,0,FALSE,FALSE,One of the finest fantasies I have read,"Exciting story, easy to read and understand and visionize. One of my top 10."
1995-11-04,US,53096531,R32X957QKAMEGB,1852423269,61043751,The Roaches Have No King (High Risk Books),Books,4,2,2,FALSE,FALSE,you will never look at roaches the same way.,"A very interesting work of fiction. It is the story of a group of roaches that inhabit an apartment in New York City.A new girlfriend has moved in with Ira and cleaned away theirfood supply. This leads our hero, a roach named Numbers, toconcoct a plan to drive away the new, tidy roomate. Numbersand his generation were literally raised in books and have become imprinted on the book in which they were raised, taking onthat book's theme in name and personality. Would have rateda bit higher but it approached ethnic differences in a somewhat stereotypical manner"
1995-11-07,US,53095937,R178X6Y87EZH9X,394756827,296214142,"Gdel, Escher, Bach: An Eternal Golden Braid",Books,5,0,0,FALSE,FALSE,True Art,"dcmsin@hk.super.net is absolutely right. As the Hacker's Dictionary puts it, this is the Must Read book for anyserious computer user - though I recommend it to anyone which can appriciate true art"
1995-11-08,US,53094761,R3KORFVOX2G1QY,380713853,611117139,Brazzaville Beach,Books,5,0,1,FALSE,FALSE,An excellent novel for holiday reading.,"This is one of the more interesting and fun novels that I have read in the last few years. It would probably appeal to many people with a scientific background. It describes research studying chimps in the wild in Africa, and ties it in with a very well-written human story about the researchers and their lives."
1995-11-08,US,53096008,R11ZEIWYRMB3Y9,819562513,114140530,"Great River: The Rio Grande in North American History. Vol. 1, Indians and Spain. Vol. 2, Mexico and the United States. 2 vols. in one",Books,5,24,24,FALSE,FALSE,Horgan's masterpiece history of the Rio Grande river.,"One of the major materpieces of American historical writing. The two volumes are a continuing delight, far better than any historical novel. Scene succeds scene, filled with movement, passion and unbelievable heroism. Won the Pulitzer and Bancroft Prizes for History, and is considered the greatest history of the Rio Grande from pre-Columbian time to mid 20th century."
1995-11-09,US,51925861,R2QYF10JPWP7BN,262510189,189809054,Ordinary Differential Equations (MIT Press),Books,5,32,35,FALSE,FALSE,A geometrical approach to differential equations.,"This is one of the few original books in the area of differential equations. In his clear style, Arnold presents the basics of differential equations. He is more interested in understanding the solutions than in deriving them by analytical methods. The text is well organized and there seem to be more figures than proofs (although all proofs are there, it just that they do not get in the way). A must, if you are in the area of chaos and dynamical systems. (RM)"
1995-11-09,US,53095810,R1O8J7W0A60O2R,446364967,500372789,The Turing Option (Questar Science Fiction),Books,5,5,7,FALSE,TRUE,About building a super-intelligent machine.,"This adventure novel explains some of the theories in my non-fiction, &quot;The Society of Mind.&quot;To find more about how the robot Sven was created, there are additional chapters at [...] or ftp://ftp.ai.mit.edu/pub/minsky/option.chapters Best wishes, Marvin Minsky, MI"
1995-11-11,US,52648220,R8XSPTXK3YTVL,914457551,710956461,The Complete Book of Golf Games,Books,5,14,14,FALSE,FALSE,A must for golfers who want to spice up their game!,"This is a delightful, as well as practical, compendium of over 80 golf side games, wagers, tournament formats, etc. -- all designed to make your next round of 18 holes more fun (and maybe more profitable!). The illustrations, trivia, and overall production quality of this book make it far superior to the older books available on the same topic. Eye-popping cover and fair price ($9.95) make it a great gift for any golfer. I highly recommend this book"
